{
  "$schema": "http://json-schema.org/draft-07/schema#",
  "title": "Generated schema for Projects",
  "type": "object",
  "properties": {
    "id": {
      "type": "string"
    },
    "name": {
      "type": "string"
    },
    "description": {
      "type": "string"
    },
    "content": {
      "type": "string"
    },
    "info": {
      "type": ["string", "null"]
    },
    "website": {
      "type": ["string", "null"]
    },
    "authors": {
      "type": "array",
      "items": {
        "type": "string"
      }
    },
    "tags": {
      "type": "array",
      "items": {
        "type": "string"
      }
    },
    "created": {
      "type": "string"
    },
    "updated": {
      "type": "string"
    },
    "version": {
      "type": "number"
    },
    "code": {
      "type": "string"
    },
    "cards": {
      "type": "array",
      "items": {
        "type": "object",
        "properties": {
          "count": {
            "type": "number"
          },
          "front": {
            "type": "object",
            "properties": {
              "Name": {
                "type": "string"
              },
              "ID": {
                "type": "string"
              },
              "SourceID": {
                "type": "string"
              },
              "Exp": {
                "type": "string"
              },
              "Width": {
                "type": "number"
              },
              "Height": {
                "type": "number"
              }
            },
            "required": [
              "Name",
              "ID",
              "SourceID",
              "Exp",
              "Width",
              "Height"
            ]
          },
          "back": {
            "type": "object",
            "properties": {
              "Name": {
                "type": "string"
              },
              "ID": {
                "type": "string"
              },
              "SourceID": {
                "type": "string"
              },
              "Exp": {
                "type": "string"
              },
              "Width": {
                "type": "number"
              },
              "Height": {
                "type": "number"
              }
            },
            "required": [
              "Name",
              "ID",
              "SourceID",
              "Exp",
              "Width",
              "Height"
            ]
          }
        },
        "required": [
          "count",
          "front",
          "back"
        ]
      }
    },
    "hash": {
      "type": "string"
    }
  },
  "required": [
    "id",
    "name",
    "description",
    "content",
    "info",
    "website",
    "authors",
    "tags",
    "created",
    "updated",
    "version",
    "code",
    "cards",
    "hash"
  ]
}
